{"$schema":"https://json-schema.org/draft/2020-12/schema","$id":"https://enterprise-agent-system.invalid/contracts/control-plane/orchestration-run.v1.schema.json","title":"Enterprise Agent System Orchestration Run v1","type":"object","additionalProperties":false,"required":["schema_version","run_id","request_subject","tasks","leases","canonical_reducer","shadow","authority","state"],"properties":{"schema_version":{"const":"enterprise-agent-system/orchestration-run/v1"},"run_id":{"type":"string","pattern":"^RUN-[A-Z0-9][A-Z0-9._-]*$"},"request_subject":{"type":"object","additionalProperties":false,"required":["repository","commit","tree"],"properties":{"repository":{"type":"string","pattern":"^[^/\\s]+/[^/\\s]+$"},"commit":{"type":"string","pattern":"^[0-9a-f]{40}$"},"tree":{"type":"string","pattern":"^[0-9a-f]{40}$"}}},"tasks":{"type":"array","minItems":1,"items":{"type":"object","additionalProperties":false,"required":["id","start_dependencies","completion_dependencies","owns_paths","required_lane","output_contract","state"],"properties":{"id":{"type":"string","pattern":"^TASK-[A-Z0-9][A-Z0-9._-]*$"},"start_dependencies":{"type":"array","uniqueItems":true,"items":{"type":"string","pattern":"^TASK-"}},"completion_dependencies":{"type":"array","uniqueItems":true,"items":{"type":"string","pattern":"^TASK-"}},"owns_paths":{"type":"array","minItems":1,"uniqueItems":true,"items":{"type":"string","minLength":1}},"required_lane":{"enum":["CLOUD","LOCAL","PRIVATE","HUMAN"]},"output_contract":{"type":"string","minLength":1},"state":{"enum":["PLANNED","READY","ACTIVE","BLOCKED","CANDIDATE","VERIFIED","COMPLETE"]}}}},"leases":{"type":"array","minItems":1,"items":{"type":"object","additionalProperties":false,"required":["task_id","writer_id","paths","resources"],"properties":{"task_id":{"type":"string","pattern":"^TASK-"},"writer_id":{"type":"string","minLength":1},"paths":{"type":"array","minItems":1,"uniqueItems":true,"items":{"type":"string","minLength":1}},"resources":{"type":"array","uniqueItems":true,"items":{"type":"string","minLength":1}}}}},"canonical_reducer":{"type":"object","additionalProperties":false,"required":["owner","may_commit"],"properties":{"owner":{"type":"string","minLength":1},"may_commit":{"const":["TASK_STATE"]}}},"shadow":{"type":"object","additionalProperties":false,"required":["read_only","separate_evaluation_path","may_commit"],"properties":{"read_only":{"const":true},"separate_evaluation_path":{"const":true},"may_commit":{"const":[]}}},"authority":{"type":"object","additionalProperties":false,"required":["automation_forbidden","human_owned"],"properties":{"automation_forbidden":{"type":"array","minItems":1,"uniqueItems":true,"items":{"type":"string","minLength":1}},"human_owned":{"type":"array","minItems":1,"uniqueItems":true,"items":{"type":"string","minLength":1}}}},"state":{"enum":["REQUEST_BOUND","SYSTEM_CONTRACT_EXTRACTED","CAPABILITY_DAG_COMPILED","TASK_DAG_COMPILED","PROMPT_PACKETS_EMITTED","WORKERS_ADMITTED","CANDIDATES_RECEIVED","CANONICAL_REDUCTION","GLOBAL_OBJECTIVE_ASSERTED","DELIVERY_HANDOFF","LOCAL_HANDOFF_REQUIRED","BLOCKED"]}}}
